<?xml version="1.0" encoding="UTF-8"?>


<!ELEMENT RECORD_UTENTE (Utente*)>

<!ELEMENT Utente (INFO_PERSONA+, Data_Registrazione, Punti_History, Membership)>

<!ATTLIST Utente 
          Privieggio (ADMIN | GESTORE | AMMINISTRATORE | CLIENTE | NONE) "NONE" >


<!ELEMENT INFO_PERSONA (Nome, Cognome, Eta, Email, Password, Sesso)> 
<!ATTLIST INFO_PERSONA 
		  ID_Persona ID  #REQUIRED>

<!ELEMENT Nome (#PCDATA)>
<!ELEMENT Cognome (#PCDATA)>
<!ELEMENT Eta (#PCDATA)>  
<!ELEMENT Email (#PCDATA)>
<!ELEMENT Password (#PCDATA)>
<!ELEMENT Sesso (#PCDATA)> 

<!ELEMENT Data_Registrazione (#PCDATA)>
<!ELEMENT Punti_History (#PCDATA)>
<!ELEMENT Membership (#PCDATA)>

